sep=;
PeterMcCormack;2020-07-08 22:16;0;1;"I operate three Nodeds";;;;"1280974152317485056";https://twitter.com/PeterMcCormack/status/1280974152317485056
PeterMcCormack;2020-07-08 20:33;0;13;"Bedford Clubhouse is empty";;;;"1280948107497398274";https://twitter.com/PeterMcCormack/status/1280948107497398274
PeterMcCormack;2020-07-08 19:33;4;33;"Decentralisation paid for with PPP loan, lol. https:// twitter.com/ToneVays/statu s/1280932489763139589 …";;;;"1280933033693122568";https://twitter.com/PeterMcCormack/status/1280933033693122568
PeterMcCormack;2020-07-08 19:26;0;3;"Love it";;;;"1280931224614207490";https://twitter.com/PeterMcCormack/status/1280931224614207490
PeterMcCormack;2020-07-08 17:09;0;1;"Then I shall also get what I deserve";;;;"1280896873113493505";https://twitter.com/PeterMcCormack/status/1280896873113493505
PeterMcCormack;2020-07-08 16:40;0;0;"Public Squares don't have block and mute buttons so it isn't a public square.";;;;"1280889467151286273";https://twitter.com/PeterMcCormack/status/1280889467151286273
PeterMcCormack;2020-07-08 16:39;0;0;"No, I don't want idiots ruining my feed";;;;"1280889278885703685";https://twitter.com/PeterMcCormack/status/1280889278885703685
PeterMcCormack;2020-07-08 16:35;0;11;"Actually, I like the idea of having what Twitter has, temporary bans: - 1 day - 1 month - Permanent";;;;"1280888144435560448";https://twitter.com/PeterMcCormack/status/1280888144435560448
PeterMcCormack;2020-07-08 16:33;0;0;"You can already block people, it is less harsh block";;;;"1280887664401661952";https://twitter.com/PeterMcCormack/status/1280887664401661952
PeterMcCormack;2020-07-08 16:32;0;2;"I like the idea of them knowing, perhaps some people will learn to not be such a prick";;;;"1280887551147073536";https://twitter.com/PeterMcCormack/status/1280887551147073536
PeterMcCormack;2020-07-08 16:23;0;1;"And he blocked me. Weird.";;;;"1280885315742453762";https://twitter.com/PeterMcCormack/status/1280885315742453762
PeterMcCormack;2020-07-08 16:23;0;26;"What features would you want in a Twitter subscription model? I’ll start: - Block individuals from commenting on your Tweets without blocking them - Expanded DM management tools - What else?";;;;"1280885183735046144";https://twitter.com/PeterMcCormack/status/1280885183735046144
PeterMcCormack;2020-07-08 16:19;0;5;"It was more of a joke, lol, Jesus man, get a grip.";;;;"1280884104083451905";https://twitter.com/PeterMcCormack/status/1280884104083451905
PeterMcCormack;2020-07-08 14:51;0;0;"No, but I don't live in a totalitarian household. I explain certain things to my children.";;;;"1280861999199653889";https://twitter.com/PeterMcCormack/status/1280861999199653889
PeterMcCormack;2020-07-08 14:23;0;71;"The Last Dance on Netflix was so good. I understand basketball better now.";;;;"1280855024571203587";https://twitter.com/PeterMcCormack/status/1280855024571203587
PeterMcCormack;2020-07-08 14:11;0;7;"Yep, can’t admit this though.";;;;"1280852005209194498";https://twitter.com/PeterMcCormack/status/1280852005209194498
PeterMcCormack;2020-07-08 13:03;0;6;"I'm okay on the parenting side of things. We have rules about apps and use.";;;;"1280834939768930306";https://twitter.com/PeterMcCormack/status/1280834939768930306
PeterMcCormack;2020-07-08 12:49;1;24;"I guess we can talk about this next week. It is a minefield as a parent.";;;;"1280831298983137280";https://twitter.com/PeterMcCormack/status/1280831298983137280
PeterMcCormack;2020-07-08 12:16;0;4;"We FaceTime.";;;;"1280823102780424193";https://twitter.com/PeterMcCormack/status/1280823102780424193
PeterMcCormack;2020-07-08 12:13;0;38;"Divorced, it is a way parents can communicate when they aren't with you.";;;;"1280822406383382528";https://twitter.com/PeterMcCormack/status/1280822406383382528
PeterMcCormack;2020-07-08 11:59;0;1;"I know, which I have discovered and why I am deleting it. My post is clear on that.";;;;"1280818804357050369";https://twitter.com/PeterMcCormack/status/1280818804357050369
PeterMcCormack;2020-07-08 11:55;0;6;"Win";;;;"1280817812592869376";https://twitter.com/PeterMcCormack/status/1280817812592869376
PeterMcCormack;2020-07-08 11:55;0;0;"Don't be a prick, I have made the decision to remove it. I am just asking the question. Talk to me like that again and I'll block you.";;;;"1280817768728793093";https://twitter.com/PeterMcCormack/status/1280817768728793093
PeterMcCormack;2020-07-08 11:54;0;13;"Because they make dance videos with their friends.";;;;"1280817490268954624";https://twitter.com/PeterMcCormack/status/1280817490268954624
PeterMcCormack;2020-07-08 11:50;105;1209;"How do I explain to a 10-year-old that she needs to delete TikTok because it is communist spyware?";;;;"1280816412097941504";https://twitter.com/PeterMcCormack/status/1280816412097941504
PeterMcCormack;2020-07-08 11:48;0;1;"I have a duet with my daughter you would enjoy";;;;"1280815958072975360";https://twitter.com/PeterMcCormack/status/1280815958072975360
PeterMcCormack;2020-07-08 11:37;0;5;"Cancelled";;;;"1280813152813420545";https://twitter.com/PeterMcCormack/status/1280813152813420545
PeterMcCormack;2020-07-08 11:30;1;8;"https:// twitter.com/PeterMcCormack /status/1280793888911917057 …";;;;"1280811382087311362";https://twitter.com/PeterMcCormack/status/1280811382087311362
PeterMcCormack;2020-07-08 10:40;0;1;"I took their own hypocrisy out. Cancel culture is a left-wing tool.";;;;"1280798816124444672";https://twitter.com/PeterMcCormack/status/1280798816124444672
PeterMcCormack;2020-07-08 10:20;41;192;". @Harpers I fixed your cancel culture letter for you. pic.twitter.com/RzJQHclzhj";;@Harpers;;"1280793888911917057";https://twitter.com/PeterMcCormack/status/1280793888911917057
PeterMcCormack;2020-07-08 10:19;0;0;"Perhaps you should outline how much time is the minimum required to be spent on a piece of artwork to give it value.";;;;"1280793661119303680";https://twitter.com/PeterMcCormack/status/1280793661119303680
PeterMcCormack;2020-07-08 10:08;0;4;"Nope, just framing what people need to hear as an opening.";;;;"1280790754428956678";https://twitter.com/PeterMcCormack/status/1280790754428956678
PeterMcCormack;2020-07-08 10:07;0;0;"Modern and abstract art also requires time and patience.";;;;"1280790638594854912";https://twitter.com/PeterMcCormack/status/1280790638594854912
PeterMcCormack;2020-07-08 09:29;0;4;"To have any meaning";;;;"1280780988935700480";https://twitter.com/PeterMcCormack/status/1280780988935700480
PeterMcCormack;2020-07-08 09:20;74;287;"One of the dumbest things about the cancel culture letter is that it was an attack on the right, despite cancel culture being primarily a left-wing behaviour. How about making this apolitical? https:// twitter.com/benshapiro/sta tus/1280668642435379201 …";;;;"1280778756991434753";https://twitter.com/PeterMcCormack/status/1280778756991434753
PeterMcCormack;2020-07-08 09:07;0;4;"Exactly, number go up, government money printer go brrrr and Shitcoins suck ass. As opposed to nodes verify TX, Tor for privacy and CoinJoin.";;;;"1280775514081427457";https://twitter.com/PeterMcCormack/status/1280775514081427457
PeterMcCormack;2020-07-08 09:05;0;0;"Saif’s issue is with the category. The great thing about art is it is personal, you can ignore the art you don’t like. But yo teach people that a form of art is without value through the lens of Bitcoin is offensive.";;;;"1280774931886768128";https://twitter.com/PeterMcCormack/status/1280774931886768128
PeterMcCormack;2020-07-08 04:49;0;9;"Snoreeeeeee";;;;"1280710691775754246";https://twitter.com/PeterMcCormack/status/1280710691775754246
PeterMcCormack;2020-07-08 01:27;0;1;"The scam is the scam";;;;"1280659652477419523";https://twitter.com/PeterMcCormack/status/1280659652477419523
PeterMcCormack;2020-07-08 00:00;0;1;"Perhaps, though I think it's the clash between total rejection of democracy v accepting it's flaws but trying to work within it. The crypto stuff is actually very useful for identifying how outsiders see things.";;;;"1280637891551604737";https://twitter.com/PeterMcCormack/status/1280637891551604737
PeterMcCormack;2020-07-07 23:53;0;2;"Are you referring to the “crypto” + ”blockchain” section?";;;;"1280636044191436800";https://twitter.com/PeterMcCormack/status/1280636044191436800
PeterMcCormack;2020-07-07 23:46;0;2;"This is the original";;;;"1280634280562040835";https://twitter.com/PeterMcCormack/status/1280634280562040835
PeterMcCormack;2020-07-07 22:30;0;6;"";;;;"1280615292817813504";https://twitter.com/PeterMcCormack/status/1280615292817813504
PeterMcCormack;2020-07-07 22:29;0;1;"Timestamp: 00.23 FTW";;;;"1280614987967401984";https://twitter.com/PeterMcCormack/status/1280614987967401984
PeterMcCormack;2020-07-07 22:25;0;9;"Dating with Wendy should be your new podcast";;;;"1280614009788674048";https://twitter.com/PeterMcCormack/status/1280614009788674048
PeterMcCormack;2020-07-07 22:22;0;6;"Are you hooking your Mom up too?";;;;"1280613254310567936";https://twitter.com/PeterMcCormack/status/1280613254310567936
PeterMcCormack;2020-07-07 22:21;0;9;"It would have been nice if it was an apolitical letter.";;;;"1280613033237151744";https://twitter.com/PeterMcCormack/status/1280613033237151744
PeterMcCormack;2020-07-07 20:56;16;264;"Art pic.twitter.com/p94OuWE6az";;;;"1280591658002898946";https://twitter.com/PeterMcCormack/status/1280591658002898946
PeterMcCormack;2020-07-07 20:40;0;3;"Imagine the two together!";;;;"1280587532875583491";https://twitter.com/PeterMcCormack/status/1280587532875583491
PeterMcCormack;2020-07-07 20:37;3;127;"It needs to be someone with charisma and a sense of humour. I vote @APompliano .";;@APompliano;;"1280586852337094658";https://twitter.com/PeterMcCormack/status/1280586852337094658
PeterMcCormack;2020-07-07 20:23;0;0;"Most is meaningless. It can’t be objectively proven and doesn’t mean something isn’t art.";;;;"1280583144090013698";https://twitter.com/PeterMcCormack/status/1280583144090013698
PeterMcCormack;2020-07-07 20:20;0;0;"Lol, one article. Art is subjective.";;;;"1280582444685709312";https://twitter.com/PeterMcCormack/status/1280582444685709312
PeterMcCormack;2020-07-07 20:19;5;40;"Bitcoin never gets forgiveable loans paid for by tax payers. https:// twitter.com/stacyherbert/s tatus/1280246658475974657 …";;;;"1280582265572134913";https://twitter.com/PeterMcCormack/status/1280582265572134913
PeterMcCormack;2020-07-07 20:11;0;0;"Nobody got angry. A point was made.";;;;"1280580131736690690";https://twitter.com/PeterMcCormack/status/1280580131736690690
PeterMcCormack;2020-07-07 20:04;0;0;"I said censor or “devalue”.";;;;"1280578449472708612";https://twitter.com/PeterMcCormack/status/1280578449472708612
PeterMcCormack;2020-07-07 20:03;0;3;"I didn’t say he did. I said Google degenerate art and see who did. No, you are not, you have a subjective opinion. I just despise someone teaching an art form has no value due to “time preference”, it is nonsense.";;;;"1280578215342411776";https://twitter.com/PeterMcCormack/status/1280578215342411776
PeterMcCormack;2020-07-07 19:51;0;1;"Prove this point.";;;;"1280575266700398592";https://twitter.com/PeterMcCormack/status/1280575266700398592
PeterMcCormack;2020-07-07 18:33;0;0;"Abstract art predates accusations of money laundering.";;;;"1280555616856047616";https://twitter.com/PeterMcCormack/status/1280555616856047616
PeterMcCormack;2020-07-07 18:28;1;13;"The market decides the value. Stating any art as overvalued is subjective. https:// twitter.com/AnselLindner/s tatus/1280553497998606336 …";;;;"1280554373173690368";https://twitter.com/PeterMcCormack/status/1280554373173690368
PeterMcCormack;2020-07-07 18:09;0;0;"It’s about both. It’s about a movie which includes Saifedean’s stupid opinion on art.";;;;"1280549623938121729";https://twitter.com/PeterMcCormack/status/1280549623938121729
PeterMcCormack;2020-07-07 17:32;11;52;"Don't miss my interview with @BretWeinstein ... we discussed #Unity2020 and got a little into Bitcoin. https://www. whatbitcoindid.com/podcast/unity2 020-ending-the-two-party-system-with-bret-weinstein …";;@BretWeinstein;#Unity2020;"1280540150712410112";https://twitter.com/PeterMcCormack/status/1280540150712410112
PeterMcCormack;2020-07-07 16:57;0;9;"We'll do a live show!";;;;"1280531497443876866";https://twitter.com/PeterMcCormack/status/1280531497443876866
PeterMcCormack;2020-07-07 16:52;0;6;"I've also got to pay for the flights out to wherever you are for this... you can get the whisky in ;)";;;;"1280530018104414210";https://twitter.com/PeterMcCormack/status/1280530018104414210
PeterMcCormack;2020-07-07 16:39;0;32;"Let me consider your offer, after declining last week.";;;;"1280526810258776064";https://twitter.com/PeterMcCormack/status/1280526810258776064
PeterMcCormack;2020-07-07 16:26;0;1;"It is almost like Tucker wrote is Mt. Rushmore speech";;;;"1280523548784758786";https://twitter.com/PeterMcCormack/status/1280523548784758786
PeterMcCormack;2020-07-07 16:21;0;0;"All fixed";;;;"1280522247132889094";https://twitter.com/PeterMcCormack/status/1280522247132889094
PeterMcCormack;2020-07-07 15:47;0;2;"Lol";;;;"1280513889453604864";https://twitter.com/PeterMcCormack/status/1280513889453604864
PeterMcCormack;2020-07-07 15:31;0;1;"I’m sorry but the fact that you are even calling abstract art as low time preference means you are bowing to a new church.";;;;"1280509744944463875";https://twitter.com/PeterMcCormack/status/1280509744944463875
PeterMcCormack;2020-07-07 15:10;0;0;"Have I said he said that?";;;;"1280504369046224899";https://twitter.com/PeterMcCormack/status/1280504369046224899
PeterMcCormack;2020-07-07 14:40;0;1;"Lol";;;;"1280496883316723715";https://twitter.com/PeterMcCormack/status/1280496883316723715
PeterMcCormack;2020-07-07 12:47;5;30;"Check out my interview with @BretWeinstein , talking about his #Unity2020 plan and how Bitcoin might help. https:// twitter.com/WhatBitcoinDid /status/1280460749156937730 …";;@BretWeinstein;#Unity2020;"1280468574369460226";https://twitter.com/PeterMcCormack/status/1280468574369460226
PeterMcCormack;2020-07-07 12:15;0;2;"Then don't buy it. I think the Rothko room at Tate Modern is amazing.";;;;"1280460400463622145";https://twitter.com/PeterMcCormack/status/1280460400463622145
PeterMcCormack;2020-07-07 11:56;0;9;"Your ankle will get better, Bitcoin Cash...";;;;"1280455754177286145";https://twitter.com/PeterMcCormack/status/1280455754177286145
PeterMcCormack;2020-07-07 11:55;0;3;"There is no line.";;;;"1280455327163592704";https://twitter.com/PeterMcCormack/status/1280455327163592704
PeterMcCormack;2020-07-07 11:54;1;44;"Sure, art is subjective, different forms can create different emotions. Still, I will fight anyone who tries to devalue the entire category of abstract art in the name of Bitcoin.";;;;"1280455139074113536";https://twitter.com/PeterMcCormack/status/1280455139074113536
PeterMcCormack;2020-07-07 11:44;1;34;"Ai Wei Wei is a perfect example of an artist who uses abstract for Defiance. This rolling landscape sculpture was built from 150 tons of steel rebar, recovered after the Sichuan earthquake, where 5,000 children died due to corruption in the construction of schools. pic.twitter.com/gLZQQyHz4Z";;;;"1280452549028589569";https://twitter.com/PeterMcCormack/status/1280452549028589569
PeterMcCormack;2020-07-07 11:35;0;17;""The Degenerate Art Exhibition in Munich attracted more than a million visitors - three times more than the officially sanctioned Great German Art Exhibition." https://www. bbc.co.uk/news/magazine- 24819441 …";;;;"1280450450345598976";https://twitter.com/PeterMcCormack/status/1280450450345598976
PeterMcCormack;2020-07-07 11:32;0;19;"Don't worry, Banksy has proved that abstract art is both popular and revolutionary.";;;;"1280449695773589505";https://twitter.com/PeterMcCormack/status/1280449695773589505
PeterMcCormack;2020-07-07 11:30;0;31;"Google "Degenerate Art" and see who has tried to censor or devalue abstract art. History has not been kind to these people. Freedom of artistic expression, freedom of speech and censorship-resistant money are all the same.";;;;"1280449211067219968";https://twitter.com/PeterMcCormack/status/1280449211067219968
PeterMcCormack;2020-07-07 11:23;6;111;"This Hard Money documentary is great. Shame it doesn't come with a warning about @Saifedean 's stupid attacks on abstract art, what he calls "Degenerate Art". Yes, hard money is important but so is abstract art. https://www. hardmoneyfilm.com /";;@Saifedean;;"1280447297722232832";https://twitter.com/PeterMcCormack/status/1280447297722232832
PeterMcCormack;2020-07-07 08:39;0;3;"Basically, Tinder for investing.";;;;"1280406098831425536";https://twitter.com/PeterMcCormack/status/1280406098831425536
PeterMcCormack;2020-07-07 08:11;0;9;"We have cancellers amongst us... https:// twitter.com/twobitidiot/st atus/1280299367627399169 …";;;;"1280398927347494912";https://twitter.com/PeterMcCormack/status/1280398927347494912
PeterMcCormack;2020-07-06 18:48;0;2;"I cancelled myself";;;;"1280196894791262213";https://twitter.com/PeterMcCormack/status/1280196894791262213
PeterMcCormack;2020-07-06 18:25;1;4;"Ray, wanna do this?";;;;"1280191241968390145";https://twitter.com/PeterMcCormack/status/1280191241968390145
PeterMcCormack;2020-07-06 13:49;0;0;"Cool, but the art of calling out requires you to be right about something.";;;;"1280121703289544704";https://twitter.com/PeterMcCormack/status/1280121703289544704
PeterMcCormack;2020-07-06 12:58;0;2;"Who is this chief?";;;;"1280108924604231687";https://twitter.com/PeterMcCormack/status/1280108924604231687
PeterMcCormack;2020-07-06 11:10;1;84;"Black Death, is that all you have this week?";;;;"1280081743911976960";https://twitter.com/PeterMcCormack/status/1280081743911976960
PeterMcCormack;2020-07-05 16:30;0;2;"You forgot Brock Pierce";;;;"1279799890130935809";https://twitter.com/PeterMcCormack/status/1279799890130935809
PeterMcCormack;2020-07-05 16:29;0;0;"@DefianceCast";;@DefianceCast;;"1279799497070174210";https://twitter.com/PeterMcCormack/status/1279799497070174210
PeterMcCormack;2020-07-05 16:28;0;1;"I know what a Wallet.dat is, I was trolling :) I operate three full nodes :)";;;;"1279799198154620930";https://twitter.com/PeterMcCormack/status/1279799198154620930
PeterMcCormack;2020-07-05 15:02;0;0;"lol";;;;"1279777574772715522";https://twitter.com/PeterMcCormack/status/1279777574772715522
PeterMcCormack;2020-07-05 10:31;0;10;"Dude, that’s the opposite of boring.";;;;"1279709376710946819";https://twitter.com/PeterMcCormack/status/1279709376710946819
PeterMcCormack;2020-07-05 02:49;0;2;"It’s fun banter duh";;;;"1279593311792218116";https://twitter.com/PeterMcCormack/status/1279593311792218116
PeterMcCormack;2020-07-05 02:19;0;2;"Equities usually do well during inflationary periods (I read somewhere).";;;;"1279585737139257346";https://twitter.com/PeterMcCormack/status/1279585737139257346
PeterMcCormack;2020-07-05 02:09;0;1;"Muted. Enjoy your life.";;;;"1279583121982328832";https://twitter.com/PeterMcCormack/status/1279583121982328832
PeterMcCormack;2020-07-05 02:08;0;0;"The flag was a joke, clearly.";;;;"1279582920622182405";https://twitter.com/PeterMcCormack/status/1279582920622182405
PeterMcCormack;2020-07-05 01:59;0;41;"@hodl_american game over friendo";;@hodl_american;;"1279580696936353792";https://twitter.com/PeterMcCormack/status/1279580696936353792
PeterMcCormack;2020-07-05 01:59;0;15;"Damn Covid, I need me some America";;;;"1279580554749530112";https://twitter.com/PeterMcCormack/status/1279580554749530112
PeterMcCormack;2020-07-05 01:58;6;135;"President Kanye, why not? https:// twitter.com/kanyewest/stat us/1279575273365594112 …";;;;"1279580422234689537";https://twitter.com/PeterMcCormack/status/1279580422234689537
PeterMcCormack;2020-07-05 01:57;0;11;"Can you FedEx her to the UK?";;;;"1279580074099040257";https://twitter.com/PeterMcCormack/status/1279580074099040257
PeterMcCormack;2020-07-05 01:50;0;0;"Why would you say such a stupid argumentative thing?";;;;"1279578292698349569";https://twitter.com/PeterMcCormack/status/1279578292698349569
PeterMcCormack;2020-07-05 01:48;2;110;"pic.twitter.com/Aiw1GhM5wE";;;;"1279577822659477504";https://twitter.com/PeterMcCormack/status/1279577822659477504
PeterMcCormack;2020-07-05 01:29;0;1;"I wasn't around so it doesn’t really bother me";;;;"1279572962144923648";https://twitter.com/PeterMcCormack/status/1279572962144923648
PeterMcCormack;2020-07-04 19:47;0;0;"Lads lads lads, this started as a bit of fun, let’s not fight";;;;"1279486915625050113";https://twitter.com/PeterMcCormack/status/1279486915625050113
PeterMcCormack;2020-07-04 19:33;1;4;"Idea Labs > Echo Chambers";;;;"1279483548009816064";https://twitter.com/PeterMcCormack/status/1279483548009816064
PeterMcCormack;2020-07-04 17:04;4;83;"https://www. newsweek.com/china-south-ch ina-sea-islands-build-military-territory-expand-575161 …";;;;"1279446094011936769";https://twitter.com/PeterMcCormack/status/1279446094011936769
PeterMcCormack;2020-07-04 16:52;0;1;"Nice";;;;"1279442913726992386";https://twitter.com/PeterMcCormack/status/1279442913726992386
PeterMcCormack;2020-07-04 15:29;0;10;"We solve problems with tea";;;;"1279422202635530240";https://twitter.com/PeterMcCormack/status/1279422202635530240
PeterMcCormack;2020-07-04 15:19;0;6;"Spurs defeat winner. https:// twitter.com/CryptoFluffy/s tatus/1279408163998117888 …";;;;"1279419612367597569";https://twitter.com/PeterMcCormack/status/1279419612367597569
PeterMcCormack;2020-07-04 13:52;0;1;"I know right, I sucker you all in ;)";;;;"1279397780109307904";https://twitter.com/PeterMcCormack/status/1279397780109307904
PeterMcCormack;2020-07-04 13:47;0;4;"Come back, I miss taking your money Charlie";;;;"1279396427760877569";https://twitter.com/PeterMcCormack/status/1279396427760877569
PeterMcCormack;2020-07-04 13:47;0;31;"pic.twitter.com/QXEcuxtseB";;;;"1279396330926936065";https://twitter.com/PeterMcCormack/status/1279396330926936065
PeterMcCormack;2020-07-04 13:43;0;30;"You are unable to be objective about this as we don't let you have the good shit";;;;"1279395455575699456";https://twitter.com/PeterMcCormack/status/1279395455575699456
PeterMcCormack;2020-07-04 13:37;0;9;"Lol, you think you won the war... pic.twitter.com/l4LGBYYghB";;;;"1279393964819468289";https://twitter.com/PeterMcCormack/status/1279393964819468289
PeterMcCormack;2020-07-04 13:36;0;58;"Hi hi, hi ho, it's off to the pub I go... pic.twitter.com/poH0Wv7BKE";;;;"1279393590393929729";https://twitter.com/PeterMcCormack/status/1279393590393929729
PeterMcCormack;2020-07-04 12:50;0;8;"H/t @theartistcoach";;@theartistcoach;;"1279382058549293056";https://twitter.com/PeterMcCormack/status/1279382058549293056
PeterMcCormack;2020-07-04 12:00;0;8;"Don’t";;;;"1279369373409595392";https://twitter.com/PeterMcCormack/status/1279369373409595392
PeterMcCormack;2020-07-04 11:21;56;919;"pic.twitter.com/4jc1RwEQRc";;;;"1279359557563822081";https://twitter.com/PeterMcCormack/status/1279359557563822081
PeterMcCormack;2020-07-03 22:39;0;29;"pic.twitter.com/27RWVATxt6";;;;"1279167891246637057";https://twitter.com/PeterMcCormack/status/1279167891246637057
PeterMcCormack;2020-07-03 21:50;0;4;"Yes they do, you win, DM me your BTC address";;;;"1279155600753131522";https://twitter.com/PeterMcCormack/status/1279155600753131522
PeterMcCormack;2020-07-03 21:15;0;2;"Hatflation";;;;"1279146879440338945";https://twitter.com/PeterMcCormack/status/1279146879440338945
PeterMcCormack;2020-07-03 21:15;55;430;"England will be back to normal this time tomorrow. pic.twitter.com/iBKFmssM2o";;;;"1279146677165789185";https://twitter.com/PeterMcCormack/status/1279146677165789185
PeterMcCormack;2020-07-03 21:12;0;6;"Drunk auction in Latvia";;;;"1279145972103368704";https://twitter.com/PeterMcCormack/status/1279145972103368704
PeterMcCormack;2020-07-03 21:11;0;3;"I bought one off him";;;;"1279145738782597122";https://twitter.com/PeterMcCormack/status/1279145738782597122
PeterMcCormack;2020-07-03 20:41;0;0;"Oh dude, this is a link to my website where my shows are broken down by guest, you should definitely check out the previous ones we have made: https://www. whatbitcoindid.com/guests Also, they both featured in this, alongside Raoul: https://www. defiance.news/podcast/the-mo ney-game-cheaters-edition …";;;;"1279138138229813249";https://twitter.com/PeterMcCormack/status/1279138138229813249
PeterMcCormack;2020-07-03 20:32;0;25;"It is me you are looking for";;;;"1279135910827831297";https://twitter.com/PeterMcCormack/status/1279135910827831297
PeterMcCormack;2020-07-03 20:28;0;7;"I would love to talk to Eric at some point too, but I interviewed Bret regarding Evergreen last year and this was a good chance to follow up.";;;;"1279134841964056577";https://twitter.com/PeterMcCormack/status/1279134841964056577
PeterMcCormack;2020-07-03 20:26;0;4;"Thanks Josh, appreciated my man";;;;"1279134445744926720";https://twitter.com/PeterMcCormack/status/1279134445744926720
PeterMcCormack;2020-07-03 20:25;15;202;"Just recorded with @BretWeinstein for @WhatBitcoinDid . We discussed Bitcoin a little. Out on Tuesday.";;@BretWeinstein @WhatBitcoinDid;;"1279134281185603584";https://twitter.com/PeterMcCormack/status/1279134281185603584
PeterMcCormack;2020-07-03 20:24;0;2;"Which one?";;;;"1279133928314613765";https://twitter.com/PeterMcCormack/status/1279133928314613765
PeterMcCormack;2020-07-03 17:44;0;0;"http:// youtube.com/defiancetv";;;;"1279093642565746688";https://twitter.com/PeterMcCormack/status/1279093642565746688
PeterMcCormack;2020-07-03 13:05;33;194;"Massive show from the RealVision event with @CaitlinLong_ , @RaoulGMI and @Travis_Kling . You definitely don't want to miss this. https:// twitter.com/WhatBitcoinDid /status/1279020757339668485 …";;@CaitlinLong_ @RaoulGMI @Travis_Kling;;"1279023431909072897";https://twitter.com/PeterMcCormack/status/1279023431909072897
